[
  {
    "retention_permanent_archive_terminal_final_consumer_notice_record_id": "retention-permanent-archive-terminal-final-consumer-notice-basic-restore-001",
    "permanent_archive_terminal_final_consumer_notice_kind": "retention_permanent_archive_terminal_final_consumer_notice",
    "created_time": "2026-01-01T00:13:42Z",
    "node_id": "formal-rollup-node-example",
    "retention_permanent_archive_terminal_final_repository_handoff_closeout_record_id": "retention-permanent-archive-terminal-final-repository-handoff-closeout-basic-restore-001",
    "retention_permanent_archive_terminal_final_repository_handoff_verification_receipt_id": "retention-permanent-archive-terminal-final-repository-handoff-verification-basic-restore-001",
    "permanent_archive_terminal_final_consumer_notice_state": "published",
    "permanent_archive_terminal_final_consumer_notice_scope": "closed_retention_permanent_archive_terminal_final_repository_handoff",
    "permanent_archive_terminal_final_consumer_notice_refs": [
      "retention-permanent-archive-terminal-final-repository-handoff-closeout-basic-restore-001",
      "retention-permanent-archive-terminal-final-repository-handoff-verification-basic-restore-001",
      "retention-permanent-archive-terminal-final-repository-handoff-basic-restore-001",
      "retention/retention-policy.json"
    ],
    "subject_refs": [
      "retention-permanent-archive-terminal-final-acceptance-record-closeout-basic-restore-001",
      "retention-permanent-archive-terminal-final-acceptance-record-verification-basic-restore-001",
      "retention-permanent-archive-terminal-final-acceptance-record-basic-restore-001"
    ],
    "basis_refs": [
      "retention-permanent-archive-terminal-final-repository-handoff-closeout-basic-restore-001",
      "retention-permanent-archive-terminal-final-repository-handoff-verification-basic-restore-001",
      "retention/retention-policy.json"
    ],
    "digest_algorithm": "sha256-sorted-retention-permanent-archive-terminal-final-consumer-notice-ref-list",
    "permanent_archive_terminal_final_consumer_notice_ref_digest": "4c2203b6a5bacafcf2825a93fe0f7ed673651eacb59199622fc412a4f3693b63",
    "permanent_archive_terminal_final_consumer_notice_by_ref": "tools/pfem_retention_permanent_archive_terminal_final_consumer_notice_records.py",
    "summary": "Synthetic example retention permanent archive terminal final consumer notice record built from the closed retention permanent archive terminal final repository handoff path."
  }
]
